{
  "meta": {
    "version": "1.0.0",
    "generated_at": "2026-05-17T06:27:40.696904",
    "updated_at": "2026-05-11T15:47:32.163162",
    "data_sources": [
      "软科排名",
      "校友会排名",
      "各高校就业质量报告",
      "官方招生数据"
    ]
  },
  "layer1_overview": {
    "name": "青岛农业大学海都学院",
    "english_name": "",
    "former_name": "",
    "location": "",
    "type": "双一流",
    "philosophy": "",
    "recommendation_level": "red",
    "summary": "",
    "radar": {
      "academic_capital": 2.1,
      "graduate_value": 3.2,
      "location_advantage": 2.8,
      "globalization": 2.3,
      "student_empowerment": 2.5,
      "brand_asset": 2.7
    },
    "weighted_score": 2.64,
    "one_sentence_recommend": ""
  },
  "layer2_core": {
    "academic_strength": {
      "esi_top_1_percent": [],
      "national_first_class_majors": [],
      "academician_count": 0,
      "teaching_language": "Chinese",
      "student_teacher_ratio": ""
    },
    "admission_data": {
      "guangdong_history_rank": 0,
      "guangdong_physics_rank": 0,
      "comp_eval_ratio": "",
      "tuition_fee": ""
    },
    "graduate_outcomes": {
      "further_study_rate": "",
      "qs_top_100_admission_rate": "",
      "starting_salary_median": 0,
      "top_destinations": [],
      "top_employers": []
    },
    "location_advantage": {
      "city": "",
      "region": "",
      "industrial_clusters": [],
      "policy_benefits": []
    },
    "comparison_peers": [],
    "risks": []
  },
  "layer3_detail": {
    "module1_academic_capital": {},
    "module2_student_competitiveness": {},
    "module3_graduate_value": {},
    "module4_location_industry": {},
    "module5_campus_ecosystem": {},
    "module6_comprehensive_evaluation": {
      "executive_summary": "青岛农业大学海都学院是一所正处于“蝶变期”的应用型本科院校。它的核心价值在于对母体学校优良学风的继承，尤其是在农学、食品和工学基础领域的扎实教学。学校目前的标签是“考研圣地”和“务实就业”，这使其在山东省内民办院校中拥有极高的性价比。然而，转设过程中的校区变动、品牌更名以及资源重组，也给学校带来了短期内的不确定性风险。",
      "one_sentence_recommend": "",
      "horizontal_comparison": []
    },
    "module7_culture_cards": {
      "temperament_tags": [
        "考研大户",
        "莱阳梨",
        "转设中",
        "务实",
        "农工结合",
        "克隆牛精神",
        "胶东粮仓"
      ]
    }
  },
  "layer4_supplement": {
    "module8_raw_data": {},
    "module9_structured_export": {}
  }
}