{
  "meta": {
    "version": "1.0.0",
    "generated_at": "2026-05-17T06:27:40.487995",
    "updated_at": "2026-05-12T11:50:02.080112",
    "data_sources": [
      "软科排名",
      "校友会排名",
      "各高校就业质量报告",
      "官方招生数据"
    ]
  },
  "layer1_overview": {
    "name": "闽江学院",
    "english_name": "",
    "former_name": "",
    "location": "",
    "type": "中外合作办学",
    "philosophy": "",
    "recommendation_level": "yellow",
    "summary": "",
    "radar": {
      "academic_capital": 3.2,
      "graduate_value": 3.8,
      "location_advantage": 4.5,
      "globalization": 3.5,
      "student_empowerment": 3.2,
      "brand_asset": 4.2
    },
    "weighted_score": 3.71,
    "one_sentence_recommend": ""
  },
  "layer2_core": {
    "academic_strength": {
      "esi_top_1_percent": [],
      "national_first_class_majors": [],
      "academician_count": 0,
      "teaching_language": "Chinese",
      "student_teacher_ratio": ""
    },
    "admission_data": {
      "guangdong_history_rank": 0,
      "guangdong_physics_rank": 0,
      "comp_eval_ratio": "",
      "tuition_fee": ""
    },
    "graduate_outcomes": {
      "further_study_rate": "",
      "qs_top_100_admission_rate": "",
      "starting_salary_median": 0,
      "top_destinations": [],
      "top_employers": []
    },
    "location_advantage": {
      "city": "",
      "region": "",
      "industrial_clusters": [],
      "policy_benefits": []
    },
    "comparison_peers": [],
    "risks": []
  },
  "layer3_detail": {
    "module1_academic_capital": {},
    "module2_student_competitiveness": {},
    "module3_graduate_value": {},
    "module4_location_industry": {},
    "module5_campus_ecosystem": {},
    "module6_comprehensive_evaluation": {
      "executive_summary": "闽江学院（闽江大学）是一所典型的“政治红利型”与“产业驱动型”高度结合的高校。它在学术排名上或许并不惊艳，但在资源获取能力、就业转化率和地方影响力上，表现出了远超其排名的实力。对于那些希望在东南沿海发展，尤其是看重就业实效而非纯学术研究的考生来说，闽江学院是一个极具性价比的选择。",
      "one_sentence_recommend": "",
      "horizontal_comparison": []
    },
    "module7_culture_cards": {
      "temperament_tags": [
        "务实到骨子里",
        "福州亲儿子",
        "纺织界的小清华",
        "考公大户",
        "转专业天堂",
        "政治高地"
      ]
    }
  },
  "layer4_supplement": {
    "module8_raw_data": {},
    "module9_structured_export": {}
  }
}