{
  "meta": {
    "version": "1.0.0",
    "generated_at": "2026-05-17T06:27:40.896615",
    "updated_at": "2026-05-09T16:54:19.741148",
    "data_sources": [
      "软科排名",
      "校友会排名",
      "各高校就业质量报告",
      "官方招生数据"
    ]
  },
  "layer1_overview": {
    "name": "西安文理学院",
    "english_name": "",
    "former_name": "",
    "location": "",
    "type": "民办",
    "philosophy": "",
    "recommendation_level": "red",
    "summary": "",
    "radar": {},
    "weighted_score": 2.62,
    "one_sentence_recommend": ""
  },
  "layer2_core": {
    "academic_strength": {
      "esi_top_1_percent": [],
      "national_first_class_majors": [],
      "academician_count": 0,
      "teaching_language": "Chinese",
      "student_teacher_ratio": ""
    },
    "admission_data": {
      "guangdong_history_rank": 0,
      "guangdong_physics_rank": 0,
      "comp_eval_ratio": "",
      "tuition_fee": ""
    },
    "graduate_outcomes": {
      "further_study_rate": "",
      "qs_top_100_admission_rate": "",
      "starting_salary_median": 0,
      "top_destinations": [],
      "top_employers": []
    },
    "location_advantage": {
      "city": "西安高新技术产业开发",
      "region": "",
      "industrial_clusters": [
        "比亚迪等数千家高新科技"
      ],
      "policy_benefits": []
    },
    "comparison_peers": [
      {
        "name": "陕西理工大学",
        "similarity": "同类院校",
        "key_difference": "陕西理工大学拥有硕士点且办学历史更久，在学术积淀和科研深度上占优；但西安文理学院占据西安高新区的核心区位，在实习机会、就业信息获取以及城市生活丰富度上完胜。对于非学术研究导向的学生，西文理的区位优势往往能转化为更直接的就业竞争力。"
      },
      {
        "name": "西安航空学院/陕西理工学院",
        "similarity": "同类院校",
        "key_difference": "西文理的学科门类更全，人文底蕴更深（关中书院背景），在师范、文史、管理类专业上更具品牌效应；而西安航空学院等则在特定工业领域有更强的垂直深度。"
      },
      {
        "name": "同类城市大学（如成都大学、广州大学）",
        "similarity": "同类院校",
        "key_difference": "西文理目前在学科层次（硕士点、博士点数量）上落后于这些一线/新一线城市的市属大学，这与其所在城市的财政投入力度及学校自身的转型速度有关，但也预示着其未来巨大的补涨空间。"
      }
    ],
    "risks": [
      {
        "category": "高新校区（主校区）",
        "description": "现代、忙碌、充满活力。宿舍条件在西安二本院校中属于中上水平，空调、暖气全覆盖。虽然没有独立卫浴，但公共洗浴设施维护较好。"
      },
      {
        "category": "太白校区",
        "description": "老校区，充满了历史感和生活气息，周边交通极其便利。"
      },
      {
        "category": "关中书院校区",
        "description": "位于西安城墙内，是学校的人文精神家园。这里不仅是教学场所，更是文化地标，学生在这里能感受到跨越百年的书院气息。\n\n**食堂文化**：\n西文理的食堂在西安高校圈小有名气。由于地处高新区，食堂不仅服务学生，也吸引了周边不少上班族。菜品种类极多，从正宗的关中面食到各地的特色小吃应有尽有，价格却保持了高校的公益性，被学生戏称为“高新区最后的平价食堂”。\n\n### 5.2 学生赋权与校园氛围\n\n*   **转专业政策**：西文理的转专业政策相对人性化。大一学年末，只要成绩排在专业前列且无挂科记录，申请转入热门专业的成功率较高。这给高考发挥失常的学生提供了第二次选择机会。\n*   **社团与创新**：学校的创新创业氛围非常浓厚。依托高新区的创业孵化器，学校建立了自己的大学生创业园。很多学生在校期间就开始承接软件开发、文化创意等外包项目，赚取人生第一桶金。\n\n### 5.3 品牌资产与社会声誉\n\n在西安市民心中，西文理是“靠谱”的代名词。\n*   **软科排名**：2025 年位列全国 426 名。虽然排名不算顶尖，但在同类市属应用型本科中表现稳健。\n*   **社会评价**：西文理的学生被评价为“踏实、肯干、不浮躁”。在西安的中小学招聘中，西文理的毕业生往往比一些外省的一本毕业生更受欢迎，因为他们对本地教材更熟悉，对本地文化更认同。\n\n---"
      }
    ]
  },
  "layer3_detail": {
    "module1_academic_capital": {},
    "module2_student_competitiveness": {},
    "module3_graduate_value": {},
    "module4_location_industry": {},
    "module5_campus_ecosystem": {},
    "module6_comprehensive_evaluation": {
      "executive_summary": "西安文理学院（以下简称“西文理”）是一所极具地域特色的全日制普通本科高校。作为西安市人民政府主办的唯一一所本科院校，该校在资源获取、政策倾斜以及与地方产业融合方面具有天然的“长子”优势。学校的历史可以追溯到 1903 年设立的西安师范学校，这种深厚的师范底蕴使其在西安乃至陕西的基础教育界拥有极高的话语权。\n\n从学术维度看，西文理目前正处于从“纯教学型”向“应用研究型”转轨的关键期。虽然目前尚未取得硕士学位授予权，但其“申硕”工作已进入最后冲刺阶段，多个学科已具备准研究生教育的实力。学校的学科布局紧贴西安“硬科技之都”的建设需求，尤其在软件工程、人工智能、表面工程等领域，通过与高新区企业的深度产教融合，走出了一条差异化竞争之路。\n\n在生源与就业方面，西文理呈现出明显的“区位溢价”特征。尽管在全国排名中并不靠前，但其在陕西省内的录取分数线常年保持在二本头部的水平，甚至在部分省份跨入一本线招生。毕业生在西安本地的就业率极高，尤其是在高新区科技企业、西安市中小学及事业单位中，西文理校友形成了紧密的职业网络。",
      "one_sentence_recommend": "",
      "horizontal_comparison": [
        {
          "name": "陕西理工大学",
          "similarity": "同类院校",
          "key_difference": "陕西理工大学拥有硕士点且办学历史更久，在学术积淀和科研深度上占优；但西安文理学院占据西安高新区的核心区位，在实习机会、就业信息获取以及城市生活丰富度上完胜。对于非学术研究导向的学生，西文理的区位优势往往能转化为更直接的就业竞争力。"
        },
        {
          "name": "西安航空学院/陕西理工学院",
          "similarity": "同类院校",
          "key_difference": "西文理的学科门类更全，人文底蕴更深（关中书院背景），在师范、文史、管理类专业上更具品牌效应；而西安航空学院等则在特定工业领域有更强的垂直深度。"
        },
        {
          "name": "同类城市大学（如成都大学、广州大学）",
          "similarity": "同类院校",
          "key_difference": "西文理目前在学科层次（硕士点、博士点数量）上落后于这些一线/新一线城市的市属大学，这与其所在城市的财政投入力度及学校自身的转型速度有关，但也预示着其未来巨大的补涨空间。"
        }
      ]
    },
    "module7_culture_cards": {
      "temperament_tags": [
        "务实主义",
        "高新邻居",
        "师范底色",
        "考公大户",
        "关中书院",
        "性价比之王",
        "西安长子"
      ]
    }
  },
  "layer4_supplement": {
    "module8_raw_data": {},
    "module9_structured_export": {}
  }
}