{
  "meta": {
    "version": "1.0.0",
    "generated_at": "2026-05-17T06:27:40.902761",
    "updated_at": "2026-05-11T15:04:37.319686",
    "data_sources": [
      "软科排名",
      "校友会排名",
      "各高校就业质量报告",
      "官方招生数据"
    ]
  },
  "layer1_overview": {
    "name": "山东英才学院",
    "english_name": "",
    "former_name": "",
    "location": "",
    "type": "双一流",
    "philosophy": "",
    "recommendation_level": "red",
    "summary": "如果你是高考分数在本科线附近，未来职业目标明确（尤其是想当幼师或护士），且家庭能够负担每年 3-4 万综合开支的山东考生，山东英才学院是省内最稳妥的选择。",
    "radar": {
      "academic_capital": 2.5,
      "graduate_value": 2.8,
      "location_advantage": 3.5,
      "globalization": 2.4,
      "student_empowerment": 2.6,
      "brand_asset": 3.0
    },
    "weighted_score": 2.79,
    "one_sentence_recommend": "如果你是高考分数在本科线附近，未来职业目标明确（尤其是想当幼师或护士），且家庭能够负担每年 3-4 万综合开支的山东考生，山东英才学院是省内最稳妥的选择。"
  },
  "layer2_core": {
    "academic_strength": {
      "esi_top_1_percent": [],
      "national_first_class_majors": [],
      "academician_count": 0,
      "teaching_language": "Chinese",
      "student_teacher_ratio": ""
    },
    "admission_data": {
      "guangdong_history_rank": 0,
      "guangdong_physics_rank": 0,
      "comp_eval_ratio": "",
      "tuition_fee": ""
    },
    "graduate_outcomes": {
      "further_study_rate": "",
      "qs_top_100_admission_rate": "",
      "starting_salary_median": 0,
      "top_destinations": [],
      "top_employers": []
    },
    "location_advantage": {
      "city": "",
      "region": "",
      "industrial_clusters": [],
      "policy_benefits": []
    },
    "comparison_peers": [],
    "risks": []
  },
  "layer3_detail": {
    "module1_academic_capital": {},
    "module2_student_competitiveness": {},
    "module3_graduate_value": {},
    "module4_location_industry": {},
    "module5_campus_ecosystem": {},
    "module6_comprehensive_evaluation": {
      "executive_summary": "*   **Identity（核心定位）：** 山东省民办高等教育的领头羊，以“应用型、重就业、严管理”为核心标签。\n*   **Ace（王牌优势）：** 学前教育专业是其皇冠上的明珠，拥有从硬件到师资的全方位行业优势；护理与工科专业紧跟济南产业规划，就业路径清晰。\n*   **Vibe（文化特质）：** 典型的“山东式”勤奋。虽然是民办校，但考研氛围浓厚，管理风格偏向保守与严格。\n*   **Risk（潜在风险）：** 极高的学费门槛可能在经济波动期导致生源流失；同时，随着公办本科扩招，民办本科的学历护城河正面临挤压。",
      "one_sentence_recommend": "如果你是高考分数在本科线附近，未来职业目标明确（尤其是想当幼师或护士），且家庭能够负担每年 3-4 万综合开支的山东考生，山东英才学院是省内最稳妥的选择。",
      "horizontal_comparison": []
    },
    "module7_culture_cards": {
      "temperament_tags": []
    }
  },
  "layer4_supplement": {
    "module8_raw_data": {},
    "module9_structured_export": {}
  }
}