{
  "meta": {
    "version": "1.0.0",
    "generated_at": "2026-05-17T06:27:40.553602",
    "updated_at": "2026-05-11T13:40:07.130752",
    "data_sources": [
      "软科排名",
      "校友会排名",
      "各高校就业质量报告",
      "官方招生数据"
    ]
  },
  "layer1_overview": {
    "name": "山东建筑大学",
    "english_name": "",
    "former_name": "",
    "location": "",
    "type": "中外合作办学",
    "philosophy": "",
    "recommendation_level": "yellow",
    "summary": "",
    "radar": {
      "academic_capital": 3.2,
      "graduate_value": 3.5,
      "location_advantage": 3.8,
      "globalization": 2.8,
      "student_empowerment": 3.4,
      "brand_asset": 3.6
    },
    "weighted_score": 3.39,
    "one_sentence_recommend": ""
  },
  "layer2_core": {
    "academic_strength": {
      "esi_top_1_percent": [],
      "national_first_class_majors": [],
      "academician_count": 0,
      "teaching_language": "Chinese",
      "student_teacher_ratio": ""
    },
    "admission_data": {
      "guangdong_history_rank": 0,
      "guangdong_physics_rank": 0,
      "comp_eval_ratio": "",
      "tuition_fee": ""
    },
    "graduate_outcomes": {
      "further_study_rate": "",
      "qs_top_100_admission_rate": "",
      "starting_salary_median": 0,
      "top_destinations": [],
      "top_employers": []
    },
    "location_advantage": {
      "city": "",
      "region": "",
      "industrial_clusters": [],
      "policy_benefits": []
    },
    "comparison_peers": [],
    "risks": []
  },
  "layer3_detail": {
    "module1_academic_capital": {},
    "module2_student_competitiveness": {},
    "module3_graduate_value": {},
    "module4_location_industry": {},
    "module5_campus_ecosystem": {},
    "module6_comprehensive_evaluation": {
      "executive_summary": "山东建筑大学是一所**优缺点极度鲜明**的大学。它是山东省内建筑行业的“黄埔军校”，在行业繁荣期，它是高性价比的代名词；在行业调整期，它正经历着转型的阵痛。其核心价值在于**极高的行业认可度**和**扎实的校友网络**。",
      "one_sentence_recommend": "",
      "horizontal_comparison": []
    },
    "module7_culture_cards": {
      "temperament_tags": []
    }
  },
  "layer4_supplement": {
    "module8_raw_data": {},
    "module9_structured_export": {}
  }
}